{
  "$schema": "http://json-schema.org/draft-07/schema#",
  "$id": "https://card-engine.dev/schemas/cardgame.v1.json",
  "title": "Card Game Ruleset",
  "description": "Schema for .cardgame.json files defining a card game's rules.",
  "type": "object",
  "required": ["meta", "deck", "zones", "roles", "phases", "scoring", "ui"],
  "additionalProperties": false,
  "properties": {
    "$schema": {
      "type": "string",
      "description": "JSON Schema reference for editor validation"
    },
    "meta": {
      "type": "object",
      "required": ["name", "slug", "version", "author", "players"],
      "properties": {
        "name": { "type": "string" },
        "slug": { "type": "string", "pattern": "^[a-z0-9-]+$" },
        "version": { "type": "string", "pattern": "^\\d+\\.\\d+\\.\\d+$" },
        "author": { "type": "string" },
        "players": {
          "type": "object",
          "required": ["min", "max"],
          "properties": {
            "min": { "type": "integer", "minimum": 1 },
            "max": { "type": "integer", "minimum": 1 }
          }
        },
        "description": {
          "type": "string",
          "minLength": 1,
          "description": "Short description of the game"
        },
        "tags": {
          "type": "array",
          "items": { "type": "string", "minLength": 1 },
          "description": "Searchable tags for catalog browsing"
        },
        "license": {
          "type": "string",
          "minLength": 1,
          "description": "License identifier (e.g., MIT, public-domain)"
        }
      }
    },
    "deck": {
      "type": "object",
      "required": ["preset", "copies", "cardValues"],
      "properties": {
        "preset": { "type": "string", "enum": ["standard_52", "standard_54", "custom"] },
        "copies": { "type": "integer", "minimum": 1 },
        "cardValues": {
          "type": "object",
          "additionalProperties": {
            "oneOf": [
              { "type": "number" },
              {
                "type": "object",
                "required": ["kind", "value"],
                "properties": {
                  "kind": { "const": "fixed" },
                  "value": { "type": "number" }
                }
              },
              {
                "type": "object",
                "required": ["kind", "low", "high"],
                "properties": {
                  "kind": { "const": "dual" },
                  "low": { "type": "number" },
                  "high": { "type": "number" }
                }
              }
            ]
          }
        }
      }
    },
    "zones": {
      "type": "array",
      "items": {
        "type": "object",
        "required": ["name", "visibility", "owners"],
        "properties": {
          "name": { "type": "string" },
          "visibility": {
            "type": "object",
            "required": ["kind"],
            "properties": {
              "kind": { "type": "string", "enum": ["public", "owner_only", "hidden", "partial"] },
              "rule": { "type": "string" }
            }
          },
          "owners": { "type": "array", "items": { "type": "string" } },
          "maxCards": { "type": "integer", "minimum": 1 },
          "phaseOverrides": {
            "type": "array",
            "items": {
              "type": "object",
              "required": ["phase", "visibility"],
              "properties": {
                "phase": { "type": "string" },
                "visibility": {
                  "type": "object",
                  "required": ["kind"],
                  "properties": {
                    "kind": { "type": "string", "enum": ["public", "owner_only", "hidden", "partial"] },
                    "rule": { "type": "string" }
                  }
                }
              }
            }
          }
        }
      }
    },
    "roles": {
      "type": "array",
      "items": {
        "type": "object",
        "required": ["name", "isHuman", "count"],
        "properties": {
          "name": { "type": "string" },
          "isHuman": { "type": "boolean" },
          "count": {
            "oneOf": [
              { "type": "integer", "minimum": 1 },
              { "const": "per_player" }
            ]
          }
        }
      }
    },
    "phases": {
      "type": "array",
      "items": {
        "type": "object",
        "required": ["name", "kind", "actions", "transitions"],
        "properties": {
          "name": { "type": "string" },
          "kind": { "type": "string", "enum": ["automatic", "turn_based", "all_players"] },
          "actions": {
            "type": "array",
            "items": {
              "type": "object",
              "required": ["name", "label"],
              "properties": {
                "name": { "type": "string" },
                "label": { "type": "string" },
                "condition": { "type": "string" },
                "effect": { "type": "array", "items": { "type": "string" } }
              }
            }
          },
          "transitions": {
            "type": "array",
            "items": {
              "type": "object",
              "required": ["to", "when"],
              "properties": {
                "to": { "type": "string" },
                "when": { "type": "string" }
              }
            }
          },
          "onEnter": { "type": "array", "items": { "type": "string" } },
          "onStep": { "type": "array", "items": { "type": "string" } },
          "onExit": { "type": "array", "items": { "type": "string" } },
          "turnOrder": { "type": "string", "enum": ["clockwise", "counterclockwise", "fixed"] },
          "autoEndTurnCondition": {
            "type": "string",
            "description": "Expression that auto-ends the current turn when true"
          }
        }
      }
    },
    "scoring": {
      "type": "object",
      "required": ["method", "winCondition"],
      "properties": {
        "method": { "type": "string" },
        "winCondition": { "type": "string" },
        "bustCondition": { "type": "string" },
        "tieCondition": {
          "type": "string",
          "description": "Expression evaluated to determine tie-breaking"
        }
      }
    },
    "variables": {
      "type": "object",
      "additionalProperties": {
        "type": "object",
        "required": ["type", "initial"],
        "properties": {
          "type": { "type": "string", "enum": ["number", "string"] },
          "initial": {},
          "public": { "type": "boolean" }
        }
      },
      "description": "Variable definitions with type, initial value, and optional public visibility"
    },
    "globalTransitions": {
      "type": "array",
      "items": {
        "type": "object",
        "required": ["to", "when"],
        "properties": {
          "to": { "type": "string" },
          "when": { "type": "string" }
        }
      },
      "description": "Cross-cutting transitions evaluated after phase-specific ones"
    },
    "ui": {
      "type": "object",
      "required": ["layout", "tableColor"],
      "properties": {
        "layout": { "type": "string", "enum": ["semicircle", "circle", "grid", "linear"] },
        "tableColor": { "type": "string", "enum": ["felt_green", "wood", "dark", "custom"] },
        "customColor": { "type": "string" }
      }
    }
  }
}
