{
  "$schema": "../packages/shared/src/schema/cardgame.v1.schema.json",
  "meta": {
    "name": "Blackjack",
    "slug": "blackjack",
    "version": "1.0.0",
    "author": "faluciano",
    "players": {
      "min": 1,
      "max": 6
    },
    "description": "Classic casino card game where players try to beat the dealer by getting closest to 21 without going over",
    "tags": ["banking", "casino", "dealer-vs-players", "classic"],
    "license": "public-domain"
  },
  "deck": {
    "preset": "standard_52",
    "copies": 2,
    "cardValues": {
      "A": { "kind": "dual", "low": 1, "high": 11 },
      "2": 2,
      "3": 3,
      "4": 4,
      "5": 5,
      "6": 6,
      "7": 7,
      "8": 8,
      "9": 9,
      "10": 10,
      "J": 10,
      "Q": 10,
      "K": 10
    }
  },
  "zones": [
    {
      "name": "draw_pile",
      "visibility": { "kind": "hidden" },
      "owners": []
    },
    {
      "name": "hand",
      "visibility": { "kind": "public" },
      "owners": ["player"]
    },
    {
      "name": "dealer_hand",
      "visibility": { "kind": "partial", "rule": "face_up_only" },
      "owners": ["dealer"],
      "phaseOverrides": [
        { "phase": "dealer_turn", "visibility": { "kind": "public" } },
        { "phase": "scoring", "visibility": { "kind": "public" } },
        { "phase": "round_end", "visibility": { "kind": "public" } }
      ]
    }
  ],
  "roles": [
    {
      "name": "player",
      "isHuman": true,
      "count": "per_player"
    },
    {
      "name": "dealer",
      "isHuman": false,
      "count": 1
    }
  ],
  "phases": [
    {
      "name": "deal",
      "kind": "automatic",
      "actions": [],
      "transitions": [{ "to": "player_turns", "when": "all_hands_dealt" }],
      "onEnter": [
        "shuffle(draw_pile)",
        "deal(draw_pile, hand, 2)",
        "deal(draw_pile, dealer_hand, 2)",
        "set_face_up(dealer_hand, 0, true)"
      ]
    },
    {
      "name": "player_turns",
      "kind": "turn_based",
      "autoEndTurnCondition": "hand_value(current_player.hand, 21) >= 21",
      "actions": [
        {
          "name": "hit",
          "label": "Hit",
          "condition": "hand_value(current_player.hand) < 21",
          "effect": ["draw(draw_pile, current_player.hand, 1)"]
        },
        {
          "name": "stand",
          "label": "Stand",
          "effect": ["end_turn()"]
        },
        {
          "name": "double_down",
          "label": "Double Down",
          "condition": "card_count(current_player.hand) == 2 && hand_value(current_player.hand) < 21",
          "effect": ["draw(draw_pile, current_player.hand, 1)", "end_turn()"]
        }
      ],
      "transitions": [{ "to": "dealer_turn", "when": "all_players_done" }],
      "turnOrder": "clockwise"
    },
    {
      "name": "dealer_turn",
      "kind": "automatic",
      "actions": [],
      "transitions": [{ "to": "scoring", "when": "hand_value(dealer_hand) >= 17" }],
      "onEnter": ["reveal_all(dealer_hand)"],
      "onStep": ["if(hand_value(dealer_hand) < 17, draw(draw_pile, dealer_hand, 1))"]
    },
    {
      "name": "scoring",
      "kind": "automatic",
      "actions": [],
      "transitions": [{ "to": "round_end", "when": "scores_calculated" }],
      "onEnter": ["calculate_scores()", "determine_winners()"]
    },
    {
      "name": "round_end",
      "kind": "all_players",
      "actions": [
        {
          "name": "new_round",
          "label": "New Round",
          "effect": ["collect_all_to(draw_pile)", "reset_round()"]
        }
      ],
      "transitions": [{ "to": "deal", "when": "continue_game" }]
    }
  ],
  "scoring": {
    "method": "hand_value(current_player.hand, 21)",
    "winCondition": "my_score <= 21 && (dealer_score > 21 || my_score > dealer_score)",
    "bustCondition": "my_score > 21",
    "tieCondition": "my_score == dealer_score && my_score <= 21"
  },
  "ui": {
    "layout": "semicircle",
    "tableColor": "felt_green"
  }
}
