{
  "$schema": "../packages/shared/src/schema/cardgame.v1.schema.json",
  "meta": {
    "name": "Crazy Eights",
    "slug": "crazy-eights",
    "version": "2.1.0",
    "author": "faluciano",
    "players": {
      "min": 2,
      "max": 4
    },
    "description": "Match cards by rank or suit, play eights as wildcards to change the active suit",
    "tags": ["matching", "shedding", "classic", "wildcards"],
    "license": "public-domain"
  },
  "deck": {
    "preset": "standard_52",
    "copies": 1,
    "cardValues": {
      "2": 2,
      "3": 3,
      "4": 4,
      "5": 5,
      "6": 6,
      "7": 7,
      "8": 50,
      "9": 9,
      "10": 10,
      "J": 10,
      "Q": 10,
      "K": 10,
      "A": 1
    }
  },
  "zones": [
    {
      "name": "draw_pile",
      "visibility": { "kind": "hidden" },
      "owners": []
    },
    {
      "name": "hand",
      "visibility": { "kind": "owner_only" },
      "owners": ["player"]
    },
    {
      "name": "discard",
      "visibility": { "kind": "public" },
      "owners": []
    },
    {
      "name": "stash",
      "visibility": { "kind": "hidden" },
      "owners": []
    }
  ],
  "roles": [
    {
      "name": "player",
      "isHuman": true,
      "count": "per_player"
    }
  ],
  "variables": {
    "active_suit": { "type": "string", "initial": "", "public": true }
  },
  "phases": [
    {
      "name": "setup",
      "kind": "automatic",
      "actions": [],
      "transitions": [{ "to": "player_turns", "when": "all_hands_dealt" }],
      "onEnter": [
        "shuffle(draw_pile)",
        "deal(draw_pile, hand, 5)",
        "move_top(draw_pile, discard, 1)",
        "flip_top(discard, 1)"
      ]
    },
    {
      "name": "player_turns",
      "kind": "turn_based",
      "actions": [
        {
          "name": "play_card",
          "label": "Play Card",
          "playTo": "discard",
          "condition": "played_card_index == -1 || card_rank_name(current_player.hand, played_card_index) == \"8\" || (get_str_var(\"active_suit\") == \"\" && played_card_matches_top(discard)) || (get_str_var(\"active_suit\") != \"\" && card_suit(current_player.hand, played_card_index) == get_str_var(\"active_suit\"))",
          "effect": [
            "set_face_up(\"discard\", 0, true)",
            "set_str_var(\"active_suit\", \"\")",
            "if(card_rank_name(discard, 0) != \"8\", end_turn())"
          ]
        },
        {
          "name": "draw",
          "label": "Draw Card",
          "condition": "count_rank(current_player.hand, \"8\") == 0 && (get_str_var(\"active_suit\") == \"\" && !has_playable_card(current_player.hand, discard) || get_str_var(\"active_suit\") != \"\" && !has_card_matching_suit(current_player.hand, get_str_var(\"active_suit\")))",
          "effect": ["draw(draw_pile, current_player.hand, 1)", "end_turn()"]
        }
      ],
      "transitions": [
        {
          "to": "scoring",
          "when": "card_count(\"hand:0\") == 0 || card_count(\"hand:1\") == 0 || if(player_count > 2, card_count(\"hand:2\") == 0, false) || if(player_count > 3, card_count(\"hand:3\") == 0, false)"
        },
        {
          "to": "choose_suit",
          "when": "card_rank_name(discard, 0) == \"8\" && get_str_var(\"active_suit\") == \"\""
        },
        { "to": "reshuffle", "when": "card_count(draw_pile) == 0 && card_count(discard) > 1" }
      ],
      "turnOrder": "clockwise"
    },
    {
      "name": "choose_suit",
      "kind": "turn_based",
      "actions": [
        {
          "name": "choose_hearts",
          "label": "Hearts",
          "effect": ["set_str_var(\"active_suit\", \"hearts\")", "end_turn()"]
        },
        {
          "name": "choose_diamonds",
          "label": "Diamonds",
          "effect": ["set_str_var(\"active_suit\", \"diamonds\")", "end_turn()"]
        },
        {
          "name": "choose_clubs",
          "label": "Clubs",
          "effect": ["set_str_var(\"active_suit\", \"clubs\")", "end_turn()"]
        },
        {
          "name": "choose_spades",
          "label": "Spades",
          "effect": ["set_str_var(\"active_suit\", \"spades\")", "end_turn()"]
        }
      ],
      "transitions": [{ "to": "player_turns", "when": "get_str_var(\"active_suit\") != \"\"" }],
      "turnOrder": "clockwise"
    },
    {
      "name": "reshuffle",
      "kind": "automatic",
      "actions": [],
      "transitions": [{ "to": "player_turns", "when": "card_count(draw_pile) > 0" }],
      "onEnter": [
        "move_top(discard, stash, 1)",
        "move_all(discard, draw_pile)",
        "shuffle(draw_pile)",
        "move_top(stash, discard, 1)"
      ]
    },
    {
      "name": "scoring",
      "kind": "automatic",
      "actions": [],
      "transitions": [{ "to": "round_end", "when": "scores_calculated" }],
      "onEnter": ["calculate_scores()", "determine_winners()"]
    },
    {
      "name": "round_end",
      "kind": "all_players",
      "actions": [
        {
          "name": "play_again",
          "label": "Play Again",
          "effect": ["collect_all_to(draw_pile)", "reset_round()"]
        }
      ],
      "transitions": [{ "to": "setup", "when": "continue_game" }]
    }
  ],
  "scoring": {
    "method": "hand_value(current_player.hand, 999)",
    "winCondition": "my_score == 0",
    "bustCondition": "false",
    "tieCondition": "false"
  },
  "ui": {
    "layout": "circle",
    "tableColor": "felt_green"
  }
}
